{
  "$schema": "https://json-schema.org/draft/2020-12/schema",
  "type": "object",
  "properties": {
    "noActivity": {
      "type": "string"
    },
    "summaryFailed": {
      "type": "string"
    },
    "skillsFailed": {
      "type": "string"
    },
    "trendingNoData": {
      "type": "string"
    },
    "trendingFailed": {
      "type": "string"
    },
    "webNoNewContent": {
      "type": "string"
    },
    "webFetchFailed": {
      "type": "string"
    },
    "hackerNewsFetchFailed": {
      "type": "string"
    },
    "trendingFetchFailed": {
      "type": "string"
    },
    "searchNoResults": {
      "type": "string"
    },
    "webSourcesAnthropic": {
      "type": "string"
    },
    "webSourcesOpenai": {
      "type": "string"
    },
    "webIssueTitle": {
      "type": "string"
    },
    "webIssueTitleFirstCrawl": {
      "type": "string"
    },
    "notifySuffixMonthly": {
      "type": "string"
    },
    "notifySuffixWeekly": {
      "type": "string"
    },
    "notifyFooterLinks": {
      "type": "string"
    },
    "feishuFooterLinks": {
      "type": "string"
    },
    "webFirstCrawlNote": {
      "type": "string"
    },
    "webIncrementalNote": {
      "type": "string"
    },
    "sampleNoteAll": {
      "type": "string"
    },
    "hackerNewsMeta": {
      "type": "string"
    },
    "productHuntMeta": {
      "type": "string"
    },
    "arxivMeta": {
      "type": "string"
    },
    "huggingFaceMeta": {
      "type": "string"
    },
    "communityMeta": {
      "type": "string"
    },
    "trendingMeta": {
      "type": "string"
    },
    "hackerNewsCount": {
      "type": "string"
    },
    "arxivCount": {
      "type": "string"
    },
    "productHuntCount": {
      "type": "string"
    },
    "huggingFaceCount": {
      "type": "string"
    },
    "headerGeneratedLabel": {
      "type": "string"
    },
    "headerSourceLabel": {
      "type": "string"
    },
    "cliTitle": {
      "type": "string"
    },
    "cliMeta": {
      "type": "string"
    },
    "cliSkillsHeading": {
      "type": "string"
    },
    "cliSkillsSource": {
      "type": "string"
    },
    "cliComparison": {
      "type": "string"
    },
    "cliDetail": {
      "type": "string"
    },
    "openclawTitle": {
      "type": "string"
    },
    "openclawMeta": {
      "type": "string"
    },
    "openclawDeepDive": {
      "type": "string"
    },
    "openclawComparison": {
      "type": "string"
    },
    "openclawPeers": {
      "type": "string"
    },
    "webTitle": {
      "type": "string"
    },
    "webMeta": {
      "type": "string"
    },
    "webModeFirstCrawl": {
      "type": "string"
    },
    "webModeIncremental": {
      "type": "string"
    },
    "webFirstCrawl": {
      "type": "string"
    },
    "webTodayUpdate": {
      "type": "string"
    },
    "webNewContent": {
      "type": "string"
    },
    "webGenerated": {
      "type": "string"
    },
    "webSourcesHeader": {
      "type": "string"
    },
    "trendingTitle": {
      "type": "string"
    },
    "trendingSources": {
      "type": "string"
    },
    "hackerNewsTitle": {
      "type": "string"
    },
    "productHuntTitle": {
      "type": "string"
    },
    "arxivTitle": {
      "type": "string"
    },
    "huggingFaceTitle": {
      "type": "string"
    },
    "communityTitle": {
      "type": "string"
    },
    "devtoArticles": {
      "type": "string"
    },
    "lobstersStories": {
      "type": "string"
    },
    "weeklyTitle": {
      "type": "string"
    },
    "weeklyCoverage": {
      "type": "string"
    },
    "monthlyTitle": {
      "type": "string"
    },
    "issueLabelCli": {
      "type": "string"
    },
    "issueLabelOpenclaw": {
      "type": "string"
    },
    "issueLabelWeb": {
      "type": "string"
    },
    "issueLabelTrending": {
      "type": "string"
    },
    "issueLabelHackerNews": {
      "type": "string"
    },
    "issueLabelProductHunt": {
      "type": "string"
    },
    "issueLabelArxiv": {
      "type": "string"
    },
    "issueLabelHuggingFace": {
      "type": "string"
    },
    "issueLabelCommunity": {
      "type": "string"
    },
    "issueTitleCli": {
      "type": "string"
    },
    "issueTitleOpenclaw": {
      "type": "string"
    },
    "issueTitleWeb": {
      "type": "string"
    },
    "issueTitleTrending": {
      "type": "string"
    },
    "issueTitleHackerNews": {
      "type": "string"
    },
    "issueTitleProductHunt": {
      "type": "string"
    },
    "issueTitleArxiv": {
      "type": "string"
    },
    "issueTitleHuggingFace": {
      "type": "string"
    },
    "issueTitleCommunity": {
      "type": "string"
    },
    "autoGen": {
      "type": "string"
    },
    "reportLabelAiCli": {
      "type": "string"
    },
    "reportLabelAiAgents": {
      "type": "string"
    },
    "reportLabelAiWeb": {
      "type": "string"
    },
    "reportLabelAiTrending": {
      "type": "string"
    },
    "reportLabelAiHackerNews": {
      "type": "string"
    },
    "reportLabelAiProductHunt": {
      "type": "string"
    },
    "reportLabelAiArxiv": {
      "type": "string"
    },
    "reportLabelAiHuggingFace": {
      "type": "string"
    },
    "reportLabelAiCommunity": {
      "type": "string"
    },
    "reportLabelAiWeekly": {
      "type": "string"
    },
    "reportLabelAiMonthly": {
      "type": "string"
    },
    "notifyCli": {
      "type": "string"
    },
    "notifyAgents": {
      "type": "string"
    },
    "notifyWeb": {
      "type": "string"
    },
    "notifyTrending": {
      "type": "string"
    },
    "notifyHn": {
      "type": "string"
    },
    "notifyPh": {
      "type": "string"
    },
    "notifyArxiv": {
      "type": "string"
    },
    "notifyHf": {
      "type": "string"
    },
    "notifyCommunity": {
      "type": "string"
    },
    "notifyWeekly": {
      "type": "string"
    },
    "notifyMonthly": {
      "type": "string"
    },
    "notifyFooter": {
      "type": "string"
    },
    "formatItemAuthor": {
      "type": "string"
    },
    "formatItemCreated": {
      "type": "string"
    },
    "formatItemUpdated": {
      "type": "string"
    },
    "formatItemComments": {
      "type": "string"
    },
    "formatItemUrl": {
      "type": "string"
    },
    "formatItemSummary": {
      "type": "string"
    },
    "sampleNote": {
      "type": "string"
    },
    "noneStr": {
      "type": "string"
    },
    "unableToExtract": {
      "type": "string"
    },
    "issueTruncation": {
      "type": "string"
    },
    "digestTruncation": {
      "type": "string"
    },
    "weeklyTruncation": {
      "type": "string"
    },
    "weeklyMeta": {
      "type": "string"
    },
    "monthlyMeta": {
      "type": "string"
    },
    "sourceLabelWeekly": {
      "type": "string"
    },
    "sourceLabelDailySampled": {
      "type": "string"
    },
    "manifestCli": {
      "type": "string"
    },
    "manifestAgents": {
      "type": "string"
    },
    "manifestWeb": {
      "type": "string"
    },
    "manifestTrending": {
      "type": "string"
    },
    "manifestHn": {
      "type": "string"
    },
    "manifestWeekly": {
      "type": "string"
    },
    "manifestMonthly": {
      "type": "string"
    },
    "autoGenFooter": {
      "type": "string"
    },
    "$schema": {
      "type": "string"
    },
    "_meta": {
      "type": "object",
      "properties": {
        "code": {
          "type": "string"
        },
        "name": {
          "type": "string"
        },
        "nativeName": {
          "type": "string"
        }
      },
      "required": [
        "code",
        "name",
        "nativeName"
      ],
      "additionalProperties": false
    }
  },
  "required": [
    "noActivity",
    "summaryFailed",
    "skillsFailed",
    "trendingNoData",
    "trendingFailed",
    "webNoNewContent",
    "webFetchFailed",
    "hackerNewsFetchFailed",
    "trendingFetchFailed",
    "searchNoResults",
    "webSourcesAnthropic",
    "webSourcesOpenai",
    "webIssueTitle",
    "webIssueTitleFirstCrawl",
    "notifySuffixMonthly",
    "notifySuffixWeekly",
    "notifyFooterLinks",
    "feishuFooterLinks",
    "webFirstCrawlNote",
    "webIncrementalNote",
    "sampleNoteAll",
    "hackerNewsMeta",
    "productHuntMeta",
    "arxivMeta",
    "huggingFaceMeta",
    "communityMeta",
    "trendingMeta",
    "hackerNewsCount",
    "arxivCount",
    "productHuntCount",
    "huggingFaceCount",
    "headerGeneratedLabel",
    "headerSourceLabel",
    "cliTitle",
    "cliMeta",
    "cliSkillsHeading",
    "cliSkillsSource",
    "cliComparison",
    "cliDetail",
    "openclawTitle",
    "openclawMeta",
    "openclawDeepDive",
    "openclawComparison",
    "openclawPeers",
    "webTitle",
    "webMeta",
    "webModeFirstCrawl",
    "webModeIncremental",
    "webFirstCrawl",
    "webTodayUpdate",
    "webNewContent",
    "webGenerated",
    "webSourcesHeader",
    "trendingTitle",
    "trendingSources",
    "hackerNewsTitle",
    "productHuntTitle",
    "arxivTitle",
    "huggingFaceTitle",
    "communityTitle",
    "devtoArticles",
    "lobstersStories",
    "weeklyTitle",
    "weeklyCoverage",
    "monthlyTitle",
    "issueLabelCli",
    "issueLabelOpenclaw",
    "issueLabelWeb",
    "issueLabelTrending",
    "issueLabelHackerNews",
    "issueLabelProductHunt",
    "issueLabelArxiv",
    "issueLabelHuggingFace",
    "issueLabelCommunity",
    "issueTitleCli",
    "issueTitleOpenclaw",
    "issueTitleWeb",
    "issueTitleTrending",
    "issueTitleHackerNews",
    "issueTitleProductHunt",
    "issueTitleArxiv",
    "issueTitleHuggingFace",
    "issueTitleCommunity",
    "autoGen",
    "reportLabelAiCli",
    "reportLabelAiAgents",
    "reportLabelAiWeb",
    "reportLabelAiTrending",
    "reportLabelAiHackerNews",
    "reportLabelAiProductHunt",
    "reportLabelAiArxiv",
    "reportLabelAiHuggingFace",
    "reportLabelAiCommunity",
    "reportLabelAiWeekly",
    "reportLabelAiMonthly",
    "notifyCli",
    "notifyAgents",
    "notifyWeb",
    "notifyTrending",
    "notifyHn",
    "notifyPh",
    "notifyArxiv",
    "notifyHf",
    "notifyCommunity",
    "notifyWeekly",
    "notifyMonthly",
    "notifyFooter",
    "formatItemAuthor",
    "formatItemCreated",
    "formatItemUpdated",
    "formatItemComments",
    "formatItemUrl",
    "formatItemSummary",
    "sampleNote",
    "noneStr",
    "unableToExtract",
    "issueTruncation",
    "digestTruncation",
    "weeklyTruncation",
    "weeklyMeta",
    "monthlyMeta",
    "sourceLabelWeekly",
    "sourceLabelDailySampled",
    "manifestCli",
    "manifestAgents",
    "manifestWeb",
    "manifestTrending",
    "manifestHn",
    "manifestWeekly",
    "manifestMonthly",
    "autoGenFooter",
    "_meta"
  ],
  "additionalProperties": false
}
