{
  "_meta": {
    "code": "uk-UA",
    "name": "Ukrainian",
    "nativeName": "Українська"
  },
  "arxivCount": "{n} papers",
  "arxivMeta": "> Papers: {count} | Generated: {utcStr} UTC\n\n",
  "arxivTitle": "ArXiv AI Research Digest",
  "autoGen": "This digest is auto-generated by",
  "autoGenFooter": ".",
  "cliComparison": "## Порівняння інструментів",
  "cliDetail": "## Звіти по інструментах",
  "cliMeta": "> Створено: {utcStr} UTC | Охоплено інструментів: {count}",
  "cliSkillsHeading": "## Основні навички Claude Code",
  "cliSkillsSource": "> Джерело: [{repo}](https://github.com/{repo})",
  "cliTitle": "Дайджест спільноти AI CLI інструментів",
  "communityMeta": "> Articles: {count} | Generated: {utcStr} UTC\n\n",
  "communityTitle": "Tech Community AI Digest",
  "devtoArticles": "articles",
  "digestTruncation": "...[скорочено]",
  "feishuFooterLinks": "\n[🌐 Web UI]  ·  [⊕ RSS]",
  "formatItemAuthor": "Автор",
  "formatItemComments": "Коментарі",
  "formatItemCreated": "Створено",
  "formatItemSummary": "Підсумок",
  "formatItemUpdated": "Оновлено",
  "formatItemUrl": "URL",
  "headerGeneratedLabel": "Generated",
  "headerSourceLabel": "Sources",
  "huggingFaceCount": "{n} models",
  "huggingFaceMeta": "> Models: {count} | Generated: {utcStr} UTC\n\n",
  "huggingFaceTitle": "Hugging Face Trending Models Digest",
  "hackerNewsCount": "{n} stories",
  "hackerNewsFetchFailed": "⚠️ Не вдалося отримати дані HN.",
  "hackerNewsMeta": "> Stories: {count} | Generated: {utcStr} UTC\n\n",
  "hackerNewsTitle": "Дайджест спільноти Hacker News AI",
  "issueLabelArxiv": "arxiv-en",
  "issueLabelCli": "digest",
  "issueLabelCommunity": "community-en",
  "issueLabelHuggingFace": "hf-en",
  "issueLabelHackerNews": "hn",
  "issueLabelOpenclaw": "openclaw",
  "issueLabelProductHunt": "ph-en",
  "issueLabelTrending": "trending",
  "issueLabelWeb": "web",
  "issueTitleArxiv": "📚 ArXiv AI Research Digest",
  "issueTitleCli": "📊 Дайджест спільноти AI CLI інструментів",
  "issueTitleCommunity": "💬 Tech Community AI Digest",
  "issueTitleHuggingFace": "🤗 Hugging Face Trending Models",
  "issueTitleHackerNews": "📰 Дайджест AI Hacker News",
  "issueTitleOpenclaw": "🦞 Дайджест екосистеми OpenClaw",
  "issueTitleProductHunt": "🚀 Product Hunt AI Digest",
  "issueTitleTrending": "📈 AI тренди з відкритим кодом",
  "issueTitleWeb": "🌐 Офіційний звіт про AI контент",
  "issueTruncation": "\n\n---\n> ⚠️ Вміст перевищує ліміт GitHub Issue. Повний звіт дивіться у закоміченому файлі Markdown.",
  "lobstersStories": "stories",
  "manifestAgents": "Дайджест екосистеми AI агентів",
  "manifestCli": "Дайджест AI CLI інструментів",
  "manifestHn": "Дайджест спільноти Hacker News AI",
  "manifestMonthly": "Щомісячний дайджест AI інструментів",
  "manifestTrending": "AI тренди з відкритим кодом",
  "manifestWeb": "Офіційний звіт про AI контент",
  "manifestWeekly": "Щотижневий дайджест AI інструментів",
  "monthlyMeta": "> Джерела: {sources} | Створено: {utcStr} UTC",
  "monthlyTitle": "Щомісячний звіт екосистеми AI інструментів",
  "noActivity": "Жодної активності за останні 24 години.",
  "noneStr": "Немає",
  "notifyAgents": "Екосистема AI агентів",
  "notifyArxiv": "ArXiv Research",
  "notifyCli": "AI CLI інструменти",
  "notifyCommunity": "Tech Community",
  "notifyFooter": "",
  "notifyFooterLinks": "\n🌐 Web UI  ·  ⊕ RSS",
  "notifyHf": "HF Models",
  "notifyHn": "Спільнота HN",
  "notifyMonthly": "AI інструменти щомісяця",
  "notifyPh": "Product Hunt",
  "notifySuffixMonthly": " Monthly Report",
  "notifySuffixWeekly": " Weekly Report",
  "notifyTrending": "Тренди GitHub",
  "notifyWeb": "Офіційні оновлення",
  "notifyWeekly": "AI інструменти щотижня",
  "openclawComparison": "## Міжекосистемне порівняння",
  "openclawDeepDive": "## Поглиблений аналіз OpenClaw",
  "openclawMeta": "> Issues: {issues} | PRs: {prs} | Охоплено проєктів: {projects} | Створено: {utcStr} UTC",
  "openclawPeers": "## Звіти споріднених проєктів",
  "openclawTitle": "Дайджест екосистеми OpenClaw",
  "productHuntCount": "{n} products",
  "productHuntMeta": "> Products: {count} | Generated: {utcStr} UTC\n\n",
  "productHuntTitle": "Product Hunt AI Products Digest",
  "reportLabelAiAgents": "AI Agents Ecosystem Digest",
  "reportLabelAiArxiv": "ArXiv AI Research Digest",
  "reportLabelAiCli": "AI CLI Tools Digest",
  "reportLabelAiCommunity": "Tech Community AI Digest",
  "reportLabelAiHuggingFace": "Hugging Face Trending Models Digest",
  "reportLabelAiHackerNews": "Hacker News AI Community Digest",
  "reportLabelAiMonthly": "AI Tools Monthly Digest",
  "reportLabelAiProductHunt": "Product Hunt AI Products Digest",
  "reportLabelAiTrending": "AI Open Source Trends",
  "reportLabelAiWeb": "Official AI Content Report",
  "reportLabelAiWeekly": "AI Tools Weekly Digest",
  "sampleNote": "(Всього: {total} елементів; показано top {sampled} за кількістю коментарів)",
  "sampleNoteAll": "(Total: {total} items)",
  "searchNoResults": "No search results found.",
  "skillsFailed": "⚠️ Не вдалося створити підсумок навичок.",
  "sourceLabelDailySampled": "{n} щоденних звітів (вибірка кожні 4 дні)",
  "sourceLabelWeekly": "{n} щотижневих звітів",
  "summaryFailed": "⚠️ Не вдалося створити підсумок.",
  "trendingFailed": "⚠️ Не вдалося створити звіт трендів.",
  "trendingFetchFailed": "⚠️ Trending data fetch failed.",
  "trendingMeta": "> Repos: {count} | Generated: {utcStr} UTC\n\n",
  "trendingNoData": "⚠️ Дані трендів недоступні, неможливо створити звіт.",
  "trendingSources": "> Джерела: GitHub Trending + GitHub Search API | Створено: {utcStr} UTC",
  "trendingTitle": "AI тренди з відкритим кодом",
  "unableToExtract": "(Не вдалося витягнути текстовий вміст)",
  "webFetchFailed": "⚠️ Не вдалося отримати веб-вміст.",
  "webFirstCrawl": "First full crawl",
  "webFirstCrawlNote": "First full crawl completed.",
  "webGenerated": "Generated: {utcStr} UTC",
  "webIncrementalNote": "Updated with {count} new articles.",
  "webIssueTitle": "🌐 AI Official Content Report",
  "webIssueTitleFirstCrawl": "🌐 AI Official Content Report (First Crawl)",
  "webMeta": "> {mode} | Новий вміст: {count} статей | Створено: {utcStr} UTC",
  "webModeFirstCrawl": "First full crawl ({n} new articles today)",
  "webModeIncremental": "Incremental update — {n} new articles today",
  "webNewContent": "New content: {count} articles",
  "webNoNewContent": "Нового вмісту не знайдено.",
  "webSourcesAnthropic": "Anthropic",
  "webSourcesHeader": "Джерела:",
  "webSourcesOpenai": "OpenAI",
  "webTitle": "Офіційний звіт про AI контент",
  "webTodayUpdate": "Today's update",
  "weeklyCoverage": "Coverage",
  "weeklyMeta": "> Охоплення: {range} | Створено: {utcStr} UTC",
  "weeklyTitle": "Щотижневий звіт екосистеми AI інструментів",
  "weeklyTruncation": "...[скорочено]"
}
