{
  "_meta": {
    "code": "ro-RO",
    "name": "Romanian",
    "nativeName": "Română"
  },
  "arxivCount": "{n} papers",
  "arxivMeta": "> Papers: {count} | Generated: {utcStr} UTC\n\n",
  "arxivTitle": "ArXiv AI Research Digest",
  "autoGen": "This digest is auto-generated by",
  "autoGenFooter": ".",
  "cliComparison": "## Comparație Inter-Instrumente",
  "cliDetail": "## Rapoarte pe Instrument",
  "cliMeta": "> Generat: {utcStr} UTC | Instrumente acoperite: {count}",
  "cliSkillsHeading": "## Puncte Forte ale Competențelor Claude Code",
  "cliSkillsSource": "> Sursă: [{repo}](https://github.com/{repo})",
  "cliTitle": "Rezumat Comunitar al Instrumentelor CLI AI",
  "communityMeta": "> Articles: {count} | Generated: {utcStr} UTC\n\n",
  "communityTitle": "Tech Community AI Digest",
  "devtoArticles": "articles",
  "digestTruncation": "...[trunchiat]",
  "feishuFooterLinks": "\n[🌐 Web UI]  ·  [⊕ RSS]",
  "formatItemAuthor": "Autor",
  "formatItemComments": "Comentarii",
  "formatItemCreated": "Creat",
  "formatItemSummary": "Rezumat",
  "formatItemUpdated": "Actualizat",
  "formatItemUrl": "URL",
  "hackerNewsCount": "{n} stories",
  "hackerNewsFetchFailed": "⚠️ Preluarea HN a eșuat.",
  "hackerNewsMeta": "> Stories: {count} | Generated: {utcStr} UTC\n\n",
  "hackerNewsTitle": "Rezumat Comunitar Hacker News AI",
  "headerGeneratedLabel": "Generated",
  "headerSourceLabel": "Sources",
  "huggingFaceCount": "{n} models",
  "huggingFaceMeta": "> Models: {count} | Generated: {utcStr} UTC\n\n",
  "huggingFaceTitle": "Hugging Face Trending Models Digest",
  "issueLabelArxiv": "arxiv-en",
  "issueLabelCli": "digest",
  "issueLabelCommunity": "community-en",
  "issueLabelHackerNews": "hn",
  "issueLabelHuggingFace": "hf-en",
  "issueLabelOpenclaw": "openclaw",
  "issueLabelProductHunt": "ph-en",
  "issueLabelTrending": "trending",
  "issueLabelWeb": "web",
  "issueTitleArxiv": "📚 ArXiv AI Research Digest",
  "issueTitleCli": "📊 Rezumat Comunitar al Instrumentelor CLI AI",
  "issueTitleCommunity": "💬 Tech Community AI Digest",
  "issueTitleHackerNews": "📰 Rezumat AI Hacker News",
  "issueTitleHuggingFace": "🤗 Hugging Face Trending Models",
  "issueTitleOpenclaw": "🦞 Rezumat Ecosistem OpenClaw",
  "issueTitleProductHunt": "🚀 Product Hunt AI Digest",
  "issueTitleTrending": "📈 Tendințe Open Source AI",
  "issueTitleWeb": "🌐 Raport Oficial de Conținut AI",
  "issueTruncation": "\n\n---\n> ⚠️ Conținutul depășește limita GitHub Issue. Consultați fișierul Markdown comis pentru raportul complet.",
  "lobstersStories": "stories",
  "manifestAgents": "Rezumat Ecosistem Agenți AI",
  "manifestCli": "Rezumat Instrumente CLI AI",
  "manifestHn": "Rezumat Comunitar Hacker News AI",
  "manifestMonthly": "Rezumat Lunar Instrumente AI",
  "manifestTrending": "Tendințe Open Source AI",
  "manifestWeb": "Raport Oficial de Conținut AI",
  "manifestWeekly": "Rezumat Săptămânal Instrumente AI",
  "monthlyMeta": "> Surse: {sources} | Generat: {utcStr} UTC",
  "monthlyTitle": "Raport Lunar al Ecosistemului de Instrumente AI",
  "noActivity": "Nicio activitate în ultimele 24 de ore.",
  "noneStr": "Niciunul",
  "notifyAgents": "Ecosistem Agenți AI",
  "notifyArxiv": "ArXiv Research",
  "notifyCli": "Instrumente CLI AI",
  "notifyCommunity": "Tech Community",
  "notifyFooter": "",
  "notifyFooterLinks": "\n🌐 Web UI  ·  ⊕ RSS",
  "notifyHf": "HF Models",
  "notifyHn": "Comunitatea HN",
  "notifyMonthly": "Instrumente AI Lunar",
  "notifyPh": "Product Hunt",
  "notifySuffixMonthly": " Monthly Report",
  "notifySuffixWeekly": " Weekly Report",
  "notifyTrending": "Tendințe GitHub",
  "notifyWeb": "Actualizări Oficiale",
  "notifyWeekly": "Instrumente AI Săptămânal",
  "openclawComparison": "## Comparație Inter-Ecosisteme",
  "openclawDeepDive": "## Analiză Aprofundată OpenClaw",
  "openclawMeta": "> Probleme: {issues} | PR-uri: {prs} | Proiecte acoperite: {projects} | Generat: {utcStr} UTC",
  "openclawPeers": "## Rapoarte ale Proiectelor Înrudite",
  "openclawTitle": "Rezumat Ecosistem OpenClaw",
  "productHuntCount": "{n} products",
  "productHuntMeta": "> Products: {count} | Generated: {utcStr} UTC\n\n",
  "productHuntTitle": "Product Hunt AI Products Digest",
  "reportLabelAiAgents": "AI Agents Ecosystem Digest",
  "reportLabelAiArxiv": "ArXiv AI Research Digest",
  "reportLabelAiCli": "AI CLI Tools Digest",
  "reportLabelAiCommunity": "Tech Community AI Digest",
  "reportLabelAiHackerNews": "Hacker News AI Community Digest",
  "reportLabelAiHuggingFace": "Hugging Face Trending Models Digest",
  "reportLabelAiMonthly": "AI Tools Monthly Digest",
  "reportLabelAiProductHunt": "Product Hunt AI Products Digest",
  "reportLabelAiTrending": "AI Open Source Trends",
  "reportLabelAiWeb": "Official AI Content Report",
  "reportLabelAiWeekly": "AI Tools Weekly Digest",
  "sampleNote": "(Total: {total} elemente; se afișează primele {sampled} după numărul de comentarii)",
  "sampleNoteAll": "(Total: {total} items)",
  "searchNoResults": "No search results found.",
  "skillsFailed": "⚠️ Generarea sumarului de competențe a eșuat.",
  "sourceLabelDailySampled": "{n} rapoarte zilnice (eșantionate la fiecare 4 zile)",
  "sourceLabelWeekly": "{n} rapoarte săptămânale",
  "summaryFailed": "⚠️ Generarea sumarului a eșuat.",
  "trendingFailed": "⚠️ Generarea raportului de tendințe a eșuat.",
  "trendingFetchFailed": "⚠️ Trending data fetch failed.",
  "trendingMeta": "> Repos: {count} | Generated: {utcStr} UTC\n\n",
  "trendingNoData": "⚠️ Datele de tendințe indisponibile, nu se poate genera raportul.",
  "trendingSources": "> Surse: GitHub Trending + GitHub Search API | Generat: {utcStr} UTC",
  "trendingTitle": "Tendințe Open Source AI",
  "unableToExtract": "(Nu s-a putut extrage conținutul textului)",
  "webFetchFailed": "⚠️ Preluarea conținutului web a eșuat.",
  "webFirstCrawl": "First full crawl",
  "webFirstCrawlNote": "First full crawl completed.",
  "webGenerated": "Generated: {utcStr} UTC",
  "webIncrementalNote": "Updated with {count} new articles.",
  "webIssueTitle": "🌐 AI Official Content Report",
  "webIssueTitleFirstCrawl": "🌐 AI Official Content Report (First Crawl)",
  "webMeta": "> {mode} | Conținut nou: {count} articole | Generat: {utcStr} UTC",
  "webModeFirstCrawl": "First full crawl ({n} new articles today)",
  "webModeIncremental": "Incremental update — {n} new articles today",
  "webNewContent": "New content: {count} articles",
  "webNoNewContent": "Niciun conținut nou găsit.",
  "webSourcesAnthropic": "Anthropic",
  "webSourcesHeader": "Surse:",
  "webSourcesOpenai": "OpenAI",
  "webTitle": "Raport Oficial de Conținut AI",
  "webTodayUpdate": "Today's update",
  "weeklyCoverage": "Coverage",
  "weeklyMeta": "> Acoperire: {range} | Generat: {utcStr} UTC",
  "weeklyTitle": "Raport Săptămânal al Ecosistemului de Instrumente AI",
  "weeklyTruncation": "...[trunchiat]"
}
