{
  "_meta": {
    "code": "ru-RU",
    "name": "Russian",
    "nativeName": "Русский"
  },
  "arxivCount": "{n} papers",
  "arxivMeta": "> Papers: {count} | Generated: {utcStr} UTC\n\n",
  "arxivTitle": "ArXiv AI Research Digest",
  "autoGen": "This digest is auto-generated by",
  "autoGenFooter": ".",
  "cliComparison": "## Сравнение инструментов",
  "cliDetail": "## Отчёты по инструментам",
  "cliMeta": "> Создано: {utcStr} UTC | Охвачено инструментов: {count}",
  "cliSkillsHeading": "## Основные навыки Claude Code",
  "cliSkillsSource": "> Источник: [{repo}](https://github.com/{repo})",
  "cliTitle": "Дайджест сообщества AI CLI-инструментов",
  "communityMeta": "> Articles: {count} | Generated: {utcStr} UTC\n\n",
  "communityTitle": "Tech Community AI Digest",
  "devtoArticles": "articles",
  "digestTruncation": "...[обрезано]",
  "feishuFooterLinks": "\n[🌐 Web UI]  ·  [⊕ RSS]",
  "formatItemAuthor": "Автор",
  "formatItemComments": "Комментарии",
  "formatItemCreated": "Создано",
  "formatItemSummary": "Сводка",
  "formatItemUpdated": "Обновлено",
  "formatItemUrl": "URL",
  "headerGeneratedLabel": "Generated",
  "headerSourceLabel": "Sources",
  "huggingFaceCount": "{n} models",
  "huggingFaceMeta": "> Models: {count} | Generated: {utcStr} UTC\n\n",
  "huggingFaceTitle": "Hugging Face Trending Models Digest",
  "hackerNewsCount": "{n} stories",
  "hackerNewsFetchFailed": "⚠️ Не удалось получить данные HN.",
  "hackerNewsMeta": "> Stories: {count} | Generated: {utcStr} UTC\n\n",
  "hackerNewsTitle": "Дайджест сообщества AI на Hacker News",
  "issueLabelArxiv": "arxiv-en",
  "issueLabelCli": "digest",
  "issueLabelCommunity": "community-en",
  "issueLabelHuggingFace": "hf-en",
  "issueLabelHackerNews": "hn",
  "issueLabelOpenclaw": "openclaw",
  "issueLabelProductHunt": "ph-en",
  "issueLabelTrending": "trending",
  "issueLabelWeb": "web",
  "issueTitleArxiv": "📚 ArXiv AI Research Digest",
  "issueTitleCli": "📊 Дайджест сообщества AI CLI-инструментов",
  "issueTitleCommunity": "💬 Tech Community AI Digest",
  "issueTitleHuggingFace": "🤗 Hugging Face Trending Models",
  "issueTitleHackerNews": "📰 Дайджест AI на Hacker News",
  "issueTitleOpenclaw": "🦞 Дайджест экосистемы OpenClaw",
  "issueTitleProductHunt": "🚀 Product Hunt AI Digest",
  "issueTitleTrending": "📈 Тренды AI с открытым исходным кодом",
  "issueTitleWeb": "🌐 Официальный отчёт о контенте AI",
  "issueTruncation": "\n\n---\n> ⚠️ Содержание превышает лимит GitHub Issue. Полный отчёт см. в приложенном Markdown-файле.",
  "lobstersStories": "stories",
  "manifestAgents": "Дайджест экосистемы AI-агентов",
  "manifestCli": "Дайджест AI CLI-инструментов",
  "manifestHn": "Дайджест AI на Hacker News",
  "manifestMonthly": "Ежемесячный дайджест AI-инструментов",
  "manifestTrending": "Тренды AI с открытым исходным кодом",
  "manifestWeb": "Официальный отчёт о контенте AI",
  "manifestWeekly": "Еженедельный дайджест AI-инструментов",
  "monthlyMeta": "> Источники: {sources} | Создано: {utcStr} UTC",
  "monthlyTitle": "Ежемесячный отчёт об экосистеме AI-инструментов",
  "noActivity": "За последние 24 часа активности не было.",
  "noneStr": "Нет",
  "notifyAgents": "Экосистема AI-агентов",
  "notifyArxiv": "ArXiv Research",
  "notifyCli": "AI CLI-инструменты",
  "notifyCommunity": "Tech Community",
  "notifyFooter": "Работает на Big Model Radar",
  "notifyFooterLinks": "\n🌐 Web UI  ·  ⊕ RSS",
  "notifyHf": "HF Models",
  "notifyHn": "Сообщество HN",
  "notifyMonthly": "AI-инструменты ежемесячно",
  "notifyPh": "Product Hunt",
  "notifySuffixMonthly": " Monthly Report",
  "notifySuffixWeekly": " Weekly Report",
  "notifyTrending": "Тренды GitHub",
  "notifyWeb": "Официальные обновления",
  "notifyWeekly": "AI-инструменты еженедельно",
  "openclawComparison": "## Сравнение экосистем",
  "openclawDeepDive": "## Глубокое погружение в OpenClaw",
  "openclawMeta": "> Issues: {issues} | PRs: {prs} | Охвачено проектов: {projects} | Создано: {utcStr} UTC",
  "openclawPeers": "## Отчёты о схожих проектах",
  "openclawTitle": "Дайджест экосистемы OpenClaw",
  "productHuntCount": "{n} products",
  "productHuntMeta": "> Products: {count} | Generated: {utcStr} UTC\n\n",
  "productHuntTitle": "Product Hunt AI Products Digest",
  "reportLabelAiAgents": "AI Agents Ecosystem Digest",
  "reportLabelAiArxiv": "ArXiv AI Research Digest",
  "reportLabelAiCli": "AI CLI Tools Digest",
  "reportLabelAiCommunity": "Tech Community AI Digest",
  "reportLabelAiHuggingFace": "Hugging Face Trending Models Digest",
  "reportLabelAiHackerNews": "Hacker News AI Community Digest",
  "reportLabelAiMonthly": "AI Tools Monthly Digest",
  "reportLabelAiProductHunt": "Product Hunt AI Products Digest",
  "reportLabelAiTrending": "AI Open Source Trends",
  "reportLabelAiWeb": "Official AI Content Report",
  "reportLabelAiWeekly": "AI Tools Weekly Digest",
  "sampleNote": "(Всего: {total} элементов; показаны top {sampled} по количеству комментариев)",
  "sampleNoteAll": "(Total: {total} items)",
  "searchNoResults": "No search results found.",
  "skillsFailed": "⚠️ Не удалось создать сводку навыков.",
  "sourceLabelDailySampled": "{n} ежедневных отчётов (выборка каждые 4 дня)",
  "sourceLabelWeekly": "{n} еженедельных отчётов",
  "summaryFailed": "⚠️ Не удалось создать сводку.",
  "trendingFailed": "⚠️ Не удалось создать отчёт о трендах.",
  "trendingFetchFailed": "⚠️ Trending data fetch failed.",
  "trendingMeta": "> Repos: {count} | Generated: {utcStr} UTC\n\n",
  "trendingNoData": "⚠️ Данные трендов недоступны, невозможно создать отчёт.",
  "trendingSources": "> Источники: GitHub Trending + GitHub Search API | Создано: {utcStr} UTC",
  "trendingTitle": "Тренды AI с открытым исходным кодом",
  "unableToExtract": "(Не удалось извлечь текстовое содержимое)",
  "webFetchFailed": "⚠️ Не удалось получить веб-контент.",
  "webFirstCrawl": "First full crawl",
  "webFirstCrawlNote": "First full crawl completed.",
  "webGenerated": "Generated: {utcStr} UTC",
  "webIncrementalNote": "Updated with {count} new articles.",
  "webIssueTitle": "🌐 AI Official Content Report",
  "webIssueTitleFirstCrawl": "🌐 AI Official Content Report (First Crawl)",
  "webMeta": "> {mode} | Нового контента: {count} статей | Создано: {utcStr} UTC",
  "webModeFirstCrawl": "First full crawl ({n} new articles today)",
  "webModeIncremental": "Incremental update — {n} new articles today",
  "webNewContent": "New content: {count} articles",
  "webNoNewContent": "Новый контент не найден.",
  "webSourcesAnthropic": "Anthropic",
  "webSourcesHeader": "Источники:",
  "webSourcesOpenai": "OpenAI",
  "webTitle": "Официальный отчёт о контенте AI",
  "webTodayUpdate": "Today's update",
  "weeklyCoverage": "Coverage",
  "weeklyMeta": "> Охват: {range} | Создано: {utcStr} UTC",
  "weeklyTitle": "Еженедельный отчёт об экосистеме AI-инструментов",
  "weeklyTruncation": "...[обрезано]"
}
