{
  "_meta": {
    "code": "ko-KR",
    "name": "Korean",
    "nativeName": "한국어"
  },
  "arxivCount": "{n} papers",
  "arxivMeta": "> Papers: {count} | Generated: {utcStr} UTC\n\n",
  "arxivTitle": "ArXiv AI Research Digest",
  "autoGen": "This digest is auto-generated by",
  "autoGenFooter": ".",
  "cliComparison": "## 도구 간 비교",
  "cliDetail": "## 도구별 보고서",
  "cliMeta": "> 생성: {utcStr} UTC | 대상 도구: {count}개",
  "cliSkillsHeading": "## Claude Code 스킬 하이라이트",
  "cliSkillsSource": "> 출처: [{repo}](https://github.com/{repo})",
  "cliTitle": "AI CLI 도구 커뮤니티 다이제스트",
  "communityMeta": "> Articles: {count} | Generated: {utcStr} UTC\n\n",
  "communityTitle": "Tech Community AI Digest",
  "devtoArticles": "articles",
  "digestTruncation": "...[축약됨]",
  "feishuFooterLinks": "\n[🌐 Web UI]  ·  [⊕ RSS]",
  "formatItemAuthor": "작성자",
  "formatItemComments": "댓글",
  "formatItemCreated": "생성일",
  "formatItemSummary": "요약",
  "formatItemUpdated": "업데이트일",
  "formatItemUrl": "URL",
  "hackerNewsCount": "{n} stories",
  "hackerNewsFetchFailed": "⚠️ HN 데이터 가져오기에 실패했습니다.",
  "hackerNewsMeta": "> Stories: {count} | Generated: {utcStr} UTC\n\n",
  "hackerNewsTitle": "Hacker News AI 커뮤니티 다이제스트",
  "headerGeneratedLabel": "Generated",
  "headerSourceLabel": "Sources",
  "huggingFaceCount": "{n} models",
  "huggingFaceMeta": "> Models: {count} | Generated: {utcStr} UTC\n\n",
  "huggingFaceTitle": "Hugging Face Trending Models Digest",
  "issueLabelArxiv": "arxiv-en",
  "issueLabelCli": "digest",
  "issueLabelCommunity": "community-en",
  "issueLabelHackerNews": "hn",
  "issueLabelHuggingFace": "hf-en",
  "issueLabelOpenclaw": "openclaw",
  "issueLabelProductHunt": "ph-en",
  "issueLabelTrending": "trending",
  "issueLabelWeb": "web",
  "issueTitleArxiv": "📚 ArXiv AI Research Digest",
  "issueTitleCli": "📊 AI CLI 도구 커뮤니티 다이제스트",
  "issueTitleCommunity": "💬 Tech Community AI Digest",
  "issueTitleHackerNews": "📰 Hacker News AI 다이제스트",
  "issueTitleHuggingFace": "🤗 Hugging Face Trending Models",
  "issueTitleOpenclaw": "🦞 OpenClaw 생태계 다이제스트",
  "issueTitleProductHunt": "🚀 Product Hunt AI Digest",
  "issueTitleTrending": "📈 AI 오픈소스 트렌드",
  "issueTitleWeb": "🌐 공식 AI 콘텐츠 보고서",
  "issueTruncation": "\n\n---\n> ⚠️ GitHub Issue 한도를 초과하는 내용입니다. 전체 보고서는 제출된 Markdown 파일을 확인하세요.",
  "lobstersStories": "stories",
  "manifestAgents": "AI 에이전트 생태계 다이제스트",
  "manifestCli": "AI CLI 도구 다이제스트",
  "manifestHn": "Hacker News AI 커뮤니티 다이제스트",
  "manifestMonthly": "AI 도구 월간 다이제스트",
  "manifestTrending": "AI 오픈소스 트렌드",
  "manifestWeb": "공식 AI 콘텐츠 보고서",
  "manifestWeekly": "AI 도구 주간 다이제스트",
  "monthlyMeta": "> 출처: {sources} | 생성: {utcStr} UTC",
  "monthlyTitle": "AI 도구 생태계 월간 보고서",
  "noActivity": "지난 24시간 동안 활동이 없습니다.",
  "noneStr": "없음",
  "notifyAgents": "AI 에이전트 생태계",
  "notifyArxiv": "ArXiv Research",
  "notifyCli": "AI CLI 도구",
  "notifyCommunity": "Tech Community",
  "notifyFooter": "Powered by Big Model Radar",
  "notifyFooterLinks": "\n🌐 Web UI  ·  ⊕ RSS",
  "notifyHf": "HF Models",
  "notifyHn": "HN 커뮤니티",
  "notifyMonthly": "AI 도구 월간",
  "notifyPh": "Product Hunt",
  "notifySuffixMonthly": " Monthly Report",
  "notifySuffixWeekly": " Weekly Report",
  "notifyTrending": "GitHub 트렌드",
  "notifyWeb": "공식 업데이트",
  "notifyWeekly": "AI 도구 주간",
  "openclawComparison": "## 생태계 간 비교",
  "openclawDeepDive": "## OpenClaw 심층 분석",
  "openclawMeta": "> 이슈: {issues} | PR: {prs} | 대상 프로젝트: {projects} | 생성: {utcStr} UTC",
  "openclawPeers": "## 피어 프로젝트 보고서",
  "openclawTitle": "OpenClaw 생태계 다이제스트",
  "productHuntCount": "{n} products",
  "productHuntMeta": "> Products: {count} | Generated: {utcStr} UTC\n\n",
  "productHuntTitle": "Product Hunt AI Products Digest",
  "reportLabelAiAgents": "AI Agents Ecosystem Digest",
  "reportLabelAiArxiv": "ArXiv AI Research Digest",
  "reportLabelAiCli": "AI CLI Tools Digest",
  "reportLabelAiCommunity": "Tech Community AI Digest",
  "reportLabelAiHackerNews": "Hacker News AI Community Digest",
  "reportLabelAiHuggingFace": "Hugging Face Trending Models Digest",
  "reportLabelAiMonthly": "AI Tools Monthly Digest",
  "reportLabelAiProductHunt": "Product Hunt AI Products Digest",
  "reportLabelAiTrending": "AI Open Source Trends",
  "reportLabelAiWeb": "Official AI Content Report",
  "reportLabelAiWeekly": "AI Tools Weekly Digest",
  "sampleNote": "(총 {total}개 항목 중 댓글 수 상위 {sampled}개 표시)",
  "sampleNoteAll": "(Total: {total} items)",
  "searchNoResults": "No search results found.",
  "skillsFailed": "⚠️ 스킬 요약 생성에 실패했습니다.",
  "sourceLabelDailySampled": "일일 보고서 {n}개(4일마다 샘플링)",
  "sourceLabelWeekly": "주간 보고서 {n}개",
  "summaryFailed": "⚠️ 요약 생성에 실패했습니다.",
  "trendingFailed": "⚠️ 트렌드 보고서 생성에 실패했습니다.",
  "trendingFetchFailed": "⚠️ Trending data fetch failed.",
  "trendingMeta": "> Repos: {count} | Generated: {utcStr} UTC\n\n",
  "trendingNoData": "⚠️ 트렌드 데이터를 사용할 수 없어 보고서를 생성할 수 없습니다.",
  "trendingSources": "> 출처: GitHub Trending + GitHub Search API | 생성: {utcStr} UTC",
  "trendingTitle": "AI 오픈소스 트렌드",
  "unableToExtract": "(텍스트 콘텐츠를 추출할 수 없습니다)",
  "webFetchFailed": "⚠️ 웹 콘텐츠 가져오기에 실패했습니다.",
  "webFirstCrawl": "First full crawl",
  "webFirstCrawlNote": "First full crawl completed.",
  "webGenerated": "Generated: {utcStr} UTC",
  "webIncrementalNote": "Updated with {count} new articles.",
  "webIssueTitle": "🌐 AI Official Content Report",
  "webIssueTitleFirstCrawl": "🌐 AI Official Content Report (First Crawl)",
  "webMeta": "> {mode} | 새 콘텐츠: {count}개 문서 | 생성: {utcStr} UTC",
  "webModeFirstCrawl": "First full crawl ({n} new articles today)",
  "webModeIncremental": "Incremental update — {n} new articles today",
  "webNewContent": "New content: {count} articles",
  "webNoNewContent": "새로운 콘텐츠를 찾을 수 없습니다.",
  "webSourcesAnthropic": "Anthropic",
  "webSourcesHeader": "출처:",
  "webSourcesOpenai": "OpenAI",
  "webTitle": "공식 AI 콘텐츠 보고서",
  "webTodayUpdate": "Today's update",
  "weeklyCoverage": "Coverage",
  "weeklyMeta": "> 대상 기간: {range} | 생성: {utcStr} UTC",
  "weeklyTitle": "AI 도구 생태계 주간 보고서",
  "weeklyTruncation": "...[축약됨]"
}
