{
  "_meta": {
    "code": "nl-NL",
    "name": "Dutch",
    "nativeName": "Nederlands"
  },
  "arxivCount": "{n} papers",
  "arxivMeta": "> Papers: {count} | Generated: {utcStr} UTC\n\n",
  "arxivTitle": "ArXiv AI Research Digest",
  "autoGen": "This digest is auto-generated by",
  "autoGenFooter": ".",
  "cliComparison": "## Vergelijking tussen Tools",
  "cliDetail": "## Rapporten per Tool",
  "cliMeta": "> Gegenereerd: {utcStr} UTC | Gedekte tools: {count}",
  "cliSkillsHeading": "## Claude Code Vaardigheden Hoogtepunten",
  "cliSkillsSource": "> Bron: [{repo}](https://github.com/{repo})",
  "cliTitle": "AI CLI Tools Communityoverzicht",
  "communityMeta": "> Articles: {count} | Generated: {utcStr} UTC\n\n",
  "communityTitle": "Tech Community AI Digest",
  "devtoArticles": "articles",
  "digestTruncation": "...[afgekapt]",
  "feishuFooterLinks": "\n[🌐 Web UI]  ·  [⊕ RSS]",
  "formatItemAuthor": "Auteur",
  "formatItemComments": "Reacties",
  "formatItemCreated": "Aangemaakt",
  "formatItemSummary": "Samenvatting",
  "formatItemUpdated": "Bijgewerkt",
  "formatItemUrl": "URL",
  "headerGeneratedLabel": "Generated",
  "headerSourceLabel": "Sources",
  "huggingFaceCount": "{n} models",
  "huggingFaceMeta": "> Models: {count} | Generated: {utcStr} UTC\n\n",
  "huggingFaceTitle": "Hugging Face Trending Models Digest",
  "hackerNewsCount": "{n} stories",
  "hackerNewsFetchFailed": "⚠️ HN-gegevens ophalen mislukt.",
  "hackerNewsMeta": "> Stories: {count} | Generated: {utcStr} UTC\n\n",
  "hackerNewsTitle": "Hacker News AI Community Digest",
  "issueLabelArxiv": "arxiv-en",
  "issueLabelCli": "digest",
  "issueLabelCommunity": "community-en",
  "issueLabelHuggingFace": "hf-en",
  "issueLabelHackerNews": "hn",
  "issueLabelOpenclaw": "openclaw",
  "issueLabelProductHunt": "ph-en",
  "issueLabelTrending": "trending",
  "issueLabelWeb": "web",
  "issueTitleArxiv": "📚 ArXiv AI Research Digest",
  "issueTitleCli": "📊 AI CLI Tools Community Digest",
  "issueTitleCommunity": "💬 Tech Community AI Digest",
  "issueTitleHuggingFace": "🤗 Hugging Face Trending Models",
  "issueTitleHackerNews": "📰 Hacker News AI Digest",
  "issueTitleOpenclaw": "🦞 OpenClaw Ecosysteem Digest",
  "issueTitleProductHunt": "🚀 Product Hunt AI Digest",
  "issueTitleTrending": "📈 AI Open Source Trends",
  "issueTitleWeb": "🌐 Officieel AI Inhoudsrapport",
  "issueTruncation": "\n\n---\n> ⚠️ Inhoud overschrijdt de GitHub Issue-limiet. Zie het ingediende Markdown-bestand voor het volledige rapport.",
  "lobstersStories": "stories",
  "manifestAgents": "AI Agents Ecosysteem Digest",
  "manifestCli": "AI CLI Tools Digest",
  "manifestHn": "Hacker News AI Community Digest",
  "manifestMonthly": "AI Tools Maandelijkse Digest",
  "manifestTrending": "AI Open Source Trends",
  "manifestWeb": "Officieel AI Inhoudsrapport",
  "manifestWeekly": "AI Tools Wekelijkse Digest",
  "monthlyMeta": "> Bronnen: {sources} | Gegenereerd: {utcStr} UTC",
  "monthlyTitle": "Maandelijks Rapport AI Tools Ecosysteem",
  "noActivity": "Geen activiteit in de afgelopen 24 uur.",
  "noneStr": "Geen",
  "notifyAgents": "AI Agents Ecosysteem",
  "notifyArxiv": "ArXiv Research",
  "notifyCli": "AI CLI Tools",
  "notifyCommunity": "Tech Community",
  "notifyFooter": "Mogelijk gemaakt door Big Model Radar",
  "notifyFooterLinks": "\n🌐 Web UI  ·  ⊕ RSS",
  "notifyHf": "HF Models",
  "notifyHn": "HN Community",
  "notifyMonthly": "AI Tools Maandelijks",
  "notifyPh": "Product Hunt",
  "notifySuffixMonthly": " Monthly Report",
  "notifySuffixWeekly": " Weekly Report",
  "notifyTrending": "GitHub Trends",
  "notifyWeb": "Officiële Updates",
  "notifyWeekly": "AI Tools Wekelijks",
  "openclawComparison": "## Vergelijking tussen Ecosystemen",
  "openclawDeepDive": "## OpenClaw Diepgaande Analyse",
  "openclawMeta": "> Issues: {issues} | PRs: {prs} | Gedekte projecten: {projects} | Gegenereerd: {utcStr} UTC",
  "openclawPeers": "## Peer Project Rapporten",
  "openclawTitle": "OpenClaw Ecosysteem Digest",
  "productHuntCount": "{n} products",
  "productHuntMeta": "> Products: {count} | Generated: {utcStr} UTC\n\n",
  "productHuntTitle": "Product Hunt AI Products Digest",
  "reportLabelAiAgents": "AI Agents Ecosystem Digest",
  "reportLabelAiArxiv": "ArXiv AI Research Digest",
  "reportLabelAiCli": "AI CLI Tools Digest",
  "reportLabelAiCommunity": "Tech Community AI Digest",
  "reportLabelAiHuggingFace": "Hugging Face Trending Models Digest",
  "reportLabelAiHackerNews": "Hacker News AI Community Digest",
  "reportLabelAiMonthly": "AI Tools Monthly Digest",
  "reportLabelAiProductHunt": "Product Hunt AI Products Digest",
  "reportLabelAiTrending": "AI Open Source Trends",
  "reportLabelAiWeb": "Official AI Content Report",
  "reportLabelAiWeekly": "AI Tools Weekly Digest",
  "sampleNote": "(Totaal: {total} items; toon top {sampled} op basis van aantal reacties)",
  "sampleNoteAll": "(Total: {total} items)",
  "searchNoResults": "No search results found.",
  "skillsFailed": "⚠️ Vaardighedensamenvatting genereren mislukt.",
  "sourceLabelDailySampled": "{n} dagelijkse rapporten (elke 4 dagen gesampled)",
  "sourceLabelWeekly": "{n} wekelijkse rapporten",
  "summaryFailed": "⚠️ Samenvatting genereren mislukt.",
  "trendingFailed": "⚠️ Trendrapport genereren mislukt.",
  "trendingFetchFailed": "⚠️ Trending data fetch failed.",
  "trendingMeta": "> Repos: {count} | Generated: {utcStr} UTC\n\n",
  "trendingNoData": "⚠️ Trendgegevens niet beschikbaar, kan geen rapport genereren.",
  "trendingSources": "> Bronnen: GitHub Trending + GitHub Search API | Gegenereerd: {utcStr} UTC",
  "trendingTitle": "AI Open Source Trends",
  "unableToExtract": "(Kan tekstinhoud niet extraheren)",
  "webFetchFailed": "⚠️ Webinhoud ophalen mislukt.",
  "webFirstCrawl": "First full crawl",
  "webFirstCrawlNote": "First full crawl completed.",
  "webGenerated": "Generated: {utcStr} UTC",
  "webIncrementalNote": "Updated with {count} new articles.",
  "webIssueTitle": "🌐 AI Official Content Report",
  "webIssueTitleFirstCrawl": "🌐 AI Official Content Report (First Crawl)",
  "webMeta": "> {mode} | Nieuwe inhoud: {count} artikelen | Gegenereerd: {utcStr} UTC",
  "webModeFirstCrawl": "First full crawl ({n} new articles today)",
  "webModeIncremental": "Incremental update — {n} new articles today",
  "webNewContent": "New content: {count} articles",
  "webNoNewContent": "Geen nieuwe inhoud gevonden.",
  "webSourcesAnthropic": "Anthropic",
  "webSourcesHeader": "Bronnen:",
  "webSourcesOpenai": "OpenAI",
  "webTitle": "Officieel AI Inhoudsrapport",
  "webTodayUpdate": "Today's update",
  "weeklyCoverage": "Coverage",
  "weeklyMeta": "> Dekking: {range} | Gegenereerd: {utcStr} UTC",
  "weeklyTitle": "Wekelijks Rapport AI Tools Ecosysteem",
  "weeklyTruncation": "...[afgekapt]"
}
